{
  "drift_status": "verified",
  "drift_type": "semantic",
  "protected_invariant_candidate": "The user's original scope.",
  "evidence_refs": ["turn_1:user_statement"],
  "explicit_emotional_self_report": null,
  "safety_evidence_status": "none",
  "emotional_state_status_override": "not_material"
}
